{
  "$schema": "https://json-schema.org/draft/2020-12/schema",
  "$id": "https://github.com/Fbrend23/matinale-seoul/schemas/brief.schema.json",
  "title": "Brief de La Matinale de Séoul",
  "description": "Contrat de sortie de la tâche Claude planifiée. Ce que ce fichier ne peut pas dire (40 mots au plus par résumé, une seule analyse par section, la date du jour à Séoul) est vérifié par la garde de cohérence : un schéma ne compte pas les mots.",
  "type": "object",
  "additionalProperties": false,
  "required": [
    "date",
    "title",
    "standfirst",
    "sections"
  ],
  "properties": {
    "date": {
      "type": "string",
      "pattern": "^[0-9]{4}-[0-9]{2}-[0-9]{2}$",
      "description": "Jour couvert, heure de Séoul."
    },
    "title": {
      "type": "string",
      "minLength": 1,
      "maxLength": 200
    },
    "standfirst": {
      "type": "string",
      "minLength": 1,
      "maxLength": 600
    },
    "sections": {
      "type": "array",
      "minItems": 4,
      "maxItems": 4,
      "items": {
        "$ref": "#/$defs/section"
      },
      "allOf": [
        {
          "contains": {
            "properties": {
              "key": {
                "const": "tourisme"
              }
            },
            "required": [
              "key"
            ]
          }
        },
        {
          "contains": {
            "properties": {
              "key": {
                "const": "coree"
              }
            },
            "required": [
              "key"
            ]
          }
        },
        {
          "contains": {
            "properties": {
              "key": {
                "const": "tech"
              }
            },
            "required": [
              "key"
            ]
          }
        },
        {
          "contains": {
            "properties": {
              "key": {
                "const": "gaming"
              }
            },
            "required": [
              "key"
            ]
          }
        }
      ],
      "description": "Les quatre sections sont toujours présentes, même vides."
    },
    "events": {
      "type": "array",
      "items": {
        "$ref": "#/$defs/event"
      },
      "description": "Facultatif. Pop-ups et événements temporaires à Séoul, anime et manga, Pokémon, K-pop, jeu vidéo, personnages, mode et marques, festivals de Séoul, culture, food. Ce n'est PAS une cinquième rubrique : un événement écarté ne retient jamais le brief, et la liste vit dans sa propre collection jusqu'à sa date de fin. Ce que le schéma ne peut pas dire (fin ≥ début, fin ≥ aujourd'hui, 40 mots) est vérifié par scripts/lib/evenements.mjs."
    }
  },
  "$defs": {
    "section": {
      "type": "object",
      "additionalProperties": false,
      "required": [
        "key",
        "items"
      ],
      "properties": {
        "key": {
          "enum": [
            "tourisme",
            "coree",
            "tech",
            "gaming"
          ]
        },
        "empty_note": {
          "type": [
            "string",
            "null"
          ],
          "maxLength": 300,
          "description": "Une phrase disant pourquoi la section est vide. Obligatoire quand elle l'est."
        },
        "items": {
          "type": "array",
          "items": {
            "$ref": "#/$defs/item"
          }
        }
      },
      "allOf": [
        {
          "description": "Section vide sans explication : la page afficherait un trou sans le dire.",
          "if": {
            "properties": {
              "items": {
                "maxItems": 0
              }
            },
            "required": [
              "items"
            ]
          },
          "then": {
            "properties": {
              "empty_note": {
                "type": "string",
                "minLength": 1
              }
            },
            "required": [
              "empty_note"
            ]
          }
        }
      ]
    },
    "item": {
      "type": "object",
      "additionalProperties": false,
      "required": [
        "headline",
        "summary",
        "importance",
        "source_name",
        "source_url"
      ],
      "properties": {
        "headline": {
          "type": "string",
          "minLength": 1,
          "maxLength": 300
        },
        "summary": {
          "type": "string",
          "minLength": 1,
          "maxLength": 600
        },
        "analysis": {
          "type": [
            "string",
            "null"
          ],
          "maxLength": 1200
        },
        "importance": {
          "type": "integer",
          "minimum": 1,
          "maximum": 99
        },
        "tags": {
          "type": "array",
          "maxItems": 8,
          "items": {
            "type": "string",
            "pattern": "^[a-z0-9]+(?:-[a-z0-9]+)*$"
          }
        },
        "source_name": {
          "type": "string",
          "minLength": 1,
          "maxLength": 120
        },
        "source_url": {
          "type": "string",
          "format": "uri",
          "pattern": "^https://",
          "description": "En clair et complète. Jamais reconstruite de tête : la garde des liens vivants la vérifie."
        },
        "source_lang": {
          "type": "string",
          "pattern": "^[a-z]{2}(-[A-Za-z]{2,4})?$"
        },
        "published_at": {
          "type": [
            "string",
            "null"
          ],
          "format": "date-time",
          "description": "Omis quand la source ne l'horodate pas de façon fiable."
        }
      }
    },
    "event": {
      "type": "object",
      "additionalProperties": false,
      "required": [
        "name",
        "kind",
        "theme",
        "venue",
        "area",
        "start_date",
        "end_date",
        "summary",
        "source_name",
        "source_url"
      ],
      "properties": {
        "name": {
          "type": "string",
          "minLength": 1,
          "maxLength": 200
        },
        "kind": {
          "enum": [
            "popup",
            "concert",
            "exposition",
            "festival",
            "salon",
            "autre"
          ]
        },
        "theme": {
          "enum": [
            "anime",
            "pokemon",
            "kpop",
            "gaming",
            "personnages",
            "mode",
            "seoul",
            "culture",
            "food"
          ],
          "description": "Un seul thème, parmi les neuf. Pas de « autre » : les neuf couvrent tout ce qui se passe à Séoul, c'est au thème d'être juste. « seoul » : les grands rendez-vous de la ville, Han, palais, feux d'artifice, lanternes, arts de rue. « personnages » : Sanrio, Chiikawa, Miffy, Line Friends, Pop Mart, quand c'est le personnage qu'on vient voir ; une série ou un manga va dans « anime ». « mode » : les pop-ups de marque sans idol, streetwear, beauté, lifestyle ; avec un idol en tête d'affiche, c'est « kpop ». « culture » : expositions, design, photo, patrimoine, papeterie, salons, concerts hors K-pop. « food » : cafés, restaurants, boissons, marques alimentaires, fêtes de la bière."
        },
        "venue": {
          "type": "string",
          "minLength": 1,
          "maxLength": 160,
          "description": "Le lieu en coréen, tel que Naver Map l'écrit : « 포켓몬센터 성수 », « KSPO돔 ». Le site en fait une recherche Naver Map, qui ne trouve rien en anglais : sans hangul et sans map_url, l'événement est écarté."
        },
        "area": {
          "type": "string",
          "minLength": 1,
          "maxLength": 80,
          "description": "Le quartier, romanisé pour le lecteur : Seongsu, Hongdae, Jamsil. Affiché, jamais cherché."
        },
        "start_date": {
          "type": "string",
          "pattern": "^[0-9]{4}-[0-9]{2}-[0-9]{2}$"
        },
        "end_date": {
          "type": "string",
          "pattern": "^[0-9]{4}-[0-9]{2}-[0-9]{2}$",
          "description": "Dernier jour, inclus. Égal à start_date pour un événement d'un jour. Obligatoire : c'est lui qui fait sortir l'événement de la page, puis l'archive."
        },
        "summary": {
          "type": "string",
          "minLength": 1,
          "maxLength": 600
        },
        "source_name": {
          "type": "string",
          "minLength": 1,
          "maxLength": 120
        },
        "source_url": {
          "type": "string",
          "format": "uri",
          "pattern": "^https://",
          "description": "En clair et complète, jamais reconstruite : vérifiée vivante, et soumise à l’allowlist."
        },
        "source_lang": {
          "type": "string",
          "pattern": "^[a-z]{2}(-[A-Za-z]{2,4})?$"
        },
        "booking_url": {
          "type": "string",
          "format": "uri",
          "pattern": "^https://",
          "description": "Billetterie ou réservation, si elle existe. Vérifiée : morte, elle est retirée, l'événement reste."
        },
        "map_url": {
          "type": "string",
          "format": "uri",
          "pattern": "^https://(map.naver.com|naver.me)/",
          "description": "Facultatif : la fiche Naver Map du lieu, SEULEMENT si tu l'as vue. Sans elle, le site pose un lien de recherche Naver Map sur venue, jamais une adresse inventée."
        },
        "address": {
          "type": "string",
          "minLength": 1,
          "maxLength": 200,
          "description": "Facultatif : l'adresse routière du lieu en coréen (도로명 주소, « 서울 성동구 아차산로 7 »), SEULEMENT si tu l'as vue sur la fiche Naver Map du lieu ou dans la source. Le site la géocode dans le navigateur pour poser un pin sur la carte Naver. Jamais déduite du quartier, jamais reconstruite : sans hangul, l'ingestion la retire."
        }
      }
    }
  }
}
